{
  "$schema": "https://json-schema.org/draft/2020-12/schema",
  "$id": "https://wishlistdrop.example/price-contract.schema.json",
  "title": "Wishlist Drop price record",
  "type": "object",
  "required": ["product_id","canonical_url","retailer","title","current_price","currency","fetched_at","in_stock","price_history","source","confidence","error_state"],
  "additionalProperties": false,
  "properties": {
    "label": {"type":"string","description":"Set to EXAMPLE on sample data only"},
    "product_id": {"type":"string","minLength":1,"description":"Stable ID, e.g. 'awin:<aw_product_id>', 'keepa:<domainId>:<asin>', 'hukd:<thread id>'"},
    "canonical_url": {"type":"string","format":"uri"},
    "retailer": {"type":"string"},
    "title": {"type":"string"},
    "current_price": {"type":["integer","null"],"minimum":0,"description":"Minor units (pence). Null if unknown/error"},
    "currency": {"type":"string","pattern":"^[A-Z]{3}$"},
    "fetched_at": {"type":"string","format":"date-time"},
    "in_stock": {"type":["boolean","null"]},
    "was_price": {"type":["integer","null"],"minimum":0,"description":"Was/list/RRP price in minor units"},
    "is_promo": {"type":"boolean","default":false},
    "promo_code": {"type":["string","null"],"description":"Only from a source feed; never generated"},
    "delivery_cost": {"type":["integer","null"],"minimum":0},
    "price_history": {"type":"array","items":{"type":"object","required":["date","price"],"additionalProperties":false,"properties":{"date":{"type":"string","format":"date-time"},"price":{"type":["integer","null"],"minimum":0}}}},
    "source": {"type":"string","enum":["awin_feed","awin_promotions","keepa","hukd_rss","ebay_browse","manual"]},
    "confidence": {"type":"number","minimum":0,"maximum":1},
    "error_state": {"type":"string","enum":["ok","not_found","blocked","changed"]},
    "error_detail": {"type":["string","null"]},
    "watch_id": {"type":"string","description":"ebay_browse only: id of the watch-list item (data/watchlist.json) this record answers"},
    "sku": {"type":"string","pattern":"^DC[0-9A-HJKMNP-TV-Z]{10}$","description":"Drop Club catalogue id. The same product at every retailer. Not a shop's own SKU. Minted from a GTIN or from a watch-list id, never from a title."},
    "market_stats": {"type":"object","description":"ebay_browse only: spread of matching new Buy It Now GBP listings after trimming outliers (Tukey 1.5xIQR). median = 'typical price on eBay', never an RRP","required":["lowest","median","mean","count"],"additionalProperties":false,"properties":{"lowest":{"type":"integer","minimum":0},"median":{"type":"integer","minimum":0},"mean":{"type":"integer","minimum":0},"count":{"type":"integer","minimum":1},"trimmed":{"type":"integer","minimum":0},"basis":{"type":"string"}}}
  }
}
