[
  {"label":"EXAMPLE","product_id":"awin:EXAMPLE-0001","canonical_url":"https://example.com/EXAMPLE-widget","retailer":"EXAMPLE Retailer Ltd","title":"EXAMPLE Widget (fake data)","current_price":1234,"currency":"GBP","fetched_at":"2000-01-01T00:00:00Z","in_stock":true,"was_price":9999,"is_promo":true,"promo_code":"EXAMPLECODE","delivery_cost":0,"price_history":[{"date":"2000-01-01T00:00:00Z","price":9999},{"date":"2000-01-02T00:00:00Z","price":1234}],"source":"awin_feed","confidence":0.9,"error_state":"ok","error_detail":null},
  {"label":"EXAMPLE","product_id":"keepa:2:B000EXAMPLE","canonical_url":"https://example.com/EXAMPLE-asin","retailer":"EXAMPLE Marketplace","title":"EXAMPLE Gadget (fake data)","current_price":null,"currency":"GBP","fetched_at":"2000-01-01T00:00:00Z","in_stock":null,"was_price":null,"is_promo":false,"promo_code":null,"delivery_cost":null,"price_history":[],"source":"keepa","confidence":0.0,"error_state":"not_found","error_detail":"EXAMPLE: product not found"},
  {"label":"EXAMPLE","product_id":"hukd:EXAMPLE-0003","canonical_url":"https://example.com/EXAMPLE-deal","retailer":"EXAMPLE Shop","title":"EXAMPLE Deal (fake data)","current_price":111,"currency":"GBP","fetched_at":"2000-01-01T00:00:00Z","in_stock":null,"was_price":null,"is_promo":true,"promo_code":null,"delivery_cost":null,"price_history":[{"date":"2000-01-01T00:00:00Z","price":111}],"source":"hukd_rss","confidence":0.5,"error_state":"changed","error_detail":"EXAMPLE: feed format changed"}
]
